{
  "$schema": "https://json-schema.org/draft/2020-12/schema",
  "title": "AgentForge Assessment",
  "type": "object",
  "required": ["scores"],
  "properties": {
    "scores": {
      "type": "object",
      "required": ["need", "ai_fit", "verification"],
      "properties": {
        "need": {
          "type": "object",
          "required": ["frequency", "time_cost", "error_cost", "friction", "repeatability"]
        },
        "ai_fit": {
          "type": "object",
          "required": ["model_capability", "input_access", "output_verifiability", "toolability", "autonomy_safety"]
        },
        "verification": {"type": "number", "minimum": 0, "maximum": 5},
        "unacceptable_irreversible_risk": {"type": "boolean"},
        "no_real_user_or_trigger": {"type": "boolean"}
      }
    },
    "outcome_definition": {"type": ["string", "null"]},
    "current_workflow": {"type": "array"},
    "components": {"type": "array"}
  }
}
